{
  "schema_version": "approval-action-result/v1alpha1",
  "command_id": "cmd_0198f4b2-7c3a-7d20-a5c6-6b6f39e34720",
  "card_id": "crd_0198f4b2-7c3a-7d12-a5c6-6b6f39e34712",
  "applied": true,
  "status": "approved",
  "revision": 2,
  "decided_at": "2026-08-23T10:00:01.000Z",
  "error_codes": []
}
